[
  {
    "id": "skill_basic_attack",
    "name": "기본 공격",
    "replaceable": false,
    "proc_chance": 100,
    "effect_type": "damage",
    "attack_type": "physical",
    "target_side": "enemy",
    "source_stat": "STR",
    "affected_stat": null,
    "multiplier": 1,
    "hit_count": 1,
    "duration_turns": 0,
    "description": "기본 물리 공격"
  },
  {
    "id": "skill_guard_boost",
    "name": "가드 부스트",
    "replaceable": true,
    "proc_chance": 40,
    "effect_type": "buff",
    "attack_type": "auto",
    "target_side": "self",
    "source_stat": "VIT",
    "affected_stat": "VIT",
    "multiplier": 1.2,
    "hit_count": 1,
    "duration_turns": 3,
    "description": "3턴 동안 VIT를 상승시킨다"
  }
]
