[
  {
    "id": "skill_basic_attack",
    "name": "기본 공격",
    "replaceable": false,
    "proc_chance": 100,
    "effect_type": "damage",
    "attack_type": "physical",
    "target_side": "enemy",
    "source_stat": "STR",
    "affected_stat": null,
    "multiplier": 1,
    "hit_count": 1,
    "duration_turns": 0,
    "description": "기본 물리 공격"
  },
  {
    "id": "skill_multi_attack",
    "name": "멀티 공격",
    "replaceable": false,
    "proc_chance": 80,
    "effect_type": "damage",
    "attack_type": "physical",
    "target_side": "enemy",
    "source_stat": "STR",
    "affected_stat": null,
    "multiplier": 1,
    "hit_count": 5,
    "duration_turns": 0,
    "description": "기본 물리 공격"
  },
  {
    "id": "skill_guard_boost",
    "name": "가드 부스트",
    "replaceable": true,
    "proc_chance": 40,
    "effect_type": "buff",
    "attack_type": "auto",
    "target_side": "self",
    "source_stat": "VIT",
    "affected_stat": "VIT",
    "multiplier": 1.2,
    "hit_count": 1,
    "duration_turns": 3,
    "description": "3턴 동안 VIT를 상승시킨다"
  },
  {
    "id": "skill_first_aid",
    "name": "응급 회복",
    "replaceable": true,
    "proc_chance": 70,
    "effect_type": "heal",
    "attack_type": "auto",
    "target_side": "self",
    "source_stat": "MND",
    "affected_stat": null,
    "multiplier": 0.35,
    "hit_count": 1,
    "duration_turns": 0,
    "description": "자신의 HP를 회복한다"
  },
  {
    "id": "skill_weaken",
    "name": "약화",
    "replaceable": true,
    "proc_chance": 55,
    "effect_type": "debuff",
    "attack_type": "auto",
    "target_side": "enemy",
    "source_stat": "INT",
    "affected_stat": "VIT",
    "multiplier": 0.85,
    "hit_count": 1,
    "duration_turns": 2,
    "description": "적의 방어 능력을 낮춘다"
  }
]
